연번,업종명,업소명,소     재     지,전화번호
1,일반음식점,송가네 감자탕, 청주시 서원구 수곡로27번길 42 (수곡동),
2,일반음식점,술고픈 날에는, 청주시 서원구 1순환로1013번길 13 (분평동),
3,일반음식점,남경식당, 청주시 서원구 사직대로302번길 6  1층 (사직동),
4,일반음식점,청정회해물한마당, 청주시 서원구 구룡산로 264  세원청실@상가3동 1층 (수곡동),
5,일반음식점,청춘상회, 청주시 서원구 서원남로57번길 12  지하1층 (모충동),
6,일반음식점,하얀집, 청주시 서원구 용평로94번길 15  1층 (분평동),
7,일반음식점,덕이식당, 청주시 서원구 구룡산로405번길 28 (수곡동),
8,일반음식점,병아리호프, 청주시 서원구 청남로 2152  2층 (모충동),
9,일반음식점,감곡식당 , 청주시 서원구 구룡산로371번길 117 (모충동),
10,일반음식점,로드킹, 청주시 서원구 1순환로672번길 6  2층 (사창동),
11,일반음식점,회색집, 청주시 서원구 1순환로694번길 12 (사창동),
12,일반음식점,참맛돼지, 청주시 서원구 원마루로10번길 13  1층 (분평동),
13,일반음식점,문화주택, 청주시 서원구 1순환로672번길 31  1층 (사창동),
14,일반음식점,웨스턴, 청주시 서원구 무심서로 435  4층 (사직동),
15,일반음식점,모모로, 청주시 서원구 1순환로672번길 25  2층 (사창동),
16,일반음식점,흥부해장국, 청주시 서원구 호국로 55-1 (사직동),
17,일반음식점,교촌치킨, 청주시 서원구 청남로 1992  1층 (분평동),
18,일반음식점,오누이식당, 청주시 서원구 호국로 75  A동 1층 (사직동),
19,일반음식점,다사랑치킨호프, 청주시 서원구 신율로53번길 53  1층 (개신동),
20,일반음식점,뉴욕바닷가재, 청주시 서원구 1순환로 715  1층 (사창동),
21,일반음식점,위(Oui), 청주시 서원구 내수동로114번길 26 (사창동 (지하1층)),
22,일반음식점,명사십리, 청주시 서원구 원마루로8번길 15 (분평동 (1층)),
23,일반음식점,서래갈매기, 청주시 서원구 내수동로108번길 23  1층 (사창동),
24,일반음식점,언니싸롱, 청주시 서원구 원마루로20번길 3 (분평동 (1층)),
25,일반음식점,오듀오(O:duo), 청주시 서원구 1순환로672번길 50 (사창동 (2층)),
26,일반음식점,주먹밥시대 서원점, 청주시 서원구 무심서로 383 (모충동 (1층)),
27,일반음식점,고기다움, 청주시 서원구 서원남로 38 (모충동 (2층)),
28,일반음식점,밥이야기, 청주시 서원구 남이면 대림로 380  1층 (2동),
29,일반음식점,엔젤 슬라임&카페, 청주시 서원구 1순환로1063번길 77  4층 402호 (분평동  라데팡스륀느관),
30,일반음식점,라면국물편의점포차(충북대점), 청주시 서원구 1순환로704번길 78  2층 (사창동),
31,일반음식점,간이역, 청주시 서원구 1순환로1107번길 20 (분평동 외 1필지  114호),
32,일반음식점,용구비어, 청주시 서원구 신율로 49 (개신동 번지  108호),
33,일반음식점,징기스칸치킨 모충점, 청주시 서원구 쌍샘로 98 (모충동 (1층)),
34,일반음식점,대길식당, 청주시 서원구 창신로 34-1 (사창동 (1층)),
35,일반음식점,무이비 포, 청주시 서원구 원흥로100번길 72  1층 (산남동),
36,일반음식점,자담치킨 산남점, 청주시 서원구 두꺼비로78번길 63-1 (산남동 (2층)),
37,일반음식점,장군집, 청주시 서원구 성봉로220번길 156  1동 1층 (개신동),
38,일반음식점,돈황금, 청주시 서원구 장전로 81  1층 104호 (성화동),
39,일반음식점,행복식당, 청주시 서원구 남이면 연청로 1261,
40,일반음식점,리움, 청주시 서원구 두꺼비로94번길 92  1층 (산남동),
41,일반음식점,경성술집 산남점, 청주시 서원구 산남로70번길 17 (산남동 (1층)),
42,일반음식점,피자마루, 청주시 서원구 분평로 21  상가2동 1층 102호 (분평동  현대대우아파트 ),
43,일반음식점,머물고싶은자리, 청주시 서원구 산남로70번길 34 (산남동 미소시티  103호),
44,일반음식점,미소분식, 청주시 서원구 신율로 57 (개신동 (1층)),
45,일반음식점,황제코다리, 청주시 서원구 산남로10번길 18-1  1층 (산남동),
46,일반음식점,설레임, 청주시 서원구 신율로53번길 58 (개신동 (1층)),
47,일반음식점,돈앤덕, 청주시 서원구 원마루로10번길 9  1층 (분평동),
48,일반음식점,복실이식당, 청주시 서원구 매봉로2번길 40 (분평동 (1층)),
49,일반음식점,청담동말자싸롱 서원대점, 청주시 서원구 서원남로 28-2  1층 (모충동),
50,일반음식점,옆집 충대점, 청주시 서원구 내수동로108번길 23  2층 (사창동),
51,일반음식점,가장맛있는족발(산남점), 청주시 서원구 산남로62번길 15  1층 104호  105호 (산남동  두꺼비빌딩),
52,일반음식점,뻘건집, 청주시 서원구 내수동로114번길 42  1층 (사창동),
53,일반음식점,연암곱창 청주산남점, 청주시 서원구 산남로 54  1층 112호  113호 (산남동),
54,일반음식점,장미맨숀, 청주시 서원구 내수동로114번길 41  1층 (사창동),
55,일반음식점,오꾸꼬, 청주시 서원구 창직로 17-2 (사창동 (1층)),
56,일반음식점,구이구이쪽갈비, 청주시 서원구 산남로 68  1층 101호 102호 103호 (산남동  센타프라자),
57,일반음식점,황기순의 칼국수&왕돈까스 청주수곡점, 청주시 서원구 구룡산로 335  1층 (수곡동),
58,일반음식점,청송식당, 청주시 서원구 모충로 153 (사직동 (1층)),
59,일반음식점,코소쿠식당, 청주시 서원구 1순환로674번길 66  1층 (사창동),
60,일반음식점,꼬막태, 청주시 서원구 산남로62번길 25  1층 107호  108호 (산남동),
61,일반음식점,소담골, 청주시 서원구 두꺼비로60번길 25-10  1층 (산남동),
62,일반음식점,할머니손칼국수, 청주시 서원구 두꺼비로38번길 5  1층 (산남동),
63,일반음식점,쿠담, 청주시 서원구 산남로70번길 3 (산남동 (2층) 203호),
64,일반음식점,두꺼비집, 청주시 서원구 산남로62번길 15  1층 101호 (산남동  두꺼비빌딩),
65,일반음식점,오감만족플러스(오감만족+), 청주시 서원구 두꺼비로94번길 72-12  1층 (산남동),
66,일반음식점,중문떡볶이, 청주시 서원구 1순환로672번길 36 (사창동 (1층)),
67,일반음식점,마리웨일(법원점), 청주시 서원구 두꺼비로78번길 53  1층 101호  102호 (산남동),
68,일반음식점,어촌별미, 청주시 서원구 산남로62번길 15 (산남동 외 1필지 116호  117호),
69,일반음식점,노크, 청주시 서원구 서원남로 40-1 (모충동 (1층)),
70,일반음식점,신동궁감자탕뼈숯불구이, 청주시 서원구 성화로 117-1  1층 (죽림동),
71,일반음식점,고봉민김밥인, 청주시 서원구 두꺼비로38번길 44  1층 (산남동),
72,일반음식점,골드포장마차, 청주시 서원구 호국로 72-1 (사직동 외 1필지(1층)),
73,일반음식점,연우, 청주시 서원구 1순환로1013번길 19  2층 (분평동  340-8),
74,일반음식점,샤브쌈주머니사직점, 청주시 서원구 예체로 55  푸르지오캐슬 상가동 2층 206호 207호 (사직동),
75,일반음식점,엄마손, 청주시 서원구 1순환로1063번길 44  1층 (분평동),
76,일반음식점,무쇠판 쪼글이, 청주시 서원구 원흥로80번길 31-3  1층 (산남동),
77,일반음식점,통파이브산남점, 청주시 서원구 산남로70번길 26  1층 109 110호 (산남동),
78,일반음식점,누리막회, 청주시 서원구 원마루로8번길 8-13  1층 (분평동),
79,일반음식점,꼬꼬아찌, 청주시 서원구 산남로70번길 26  1층 107호  108호 (산남동  청주브릭스타워),
80,일반음식점,왱이포차, 청주시 서원구 원마루로8번길 19  1층 (분평동),
81,일반음식점,빨간대문(門), 청주시 서원구 산남로 64 (산남동  엔젤변호사빌딩 102호(1층)),
82,일반음식점,아지트꾼, 청주시 서원구 무심서로 497 (사직동  (2층)),
83,일반음식점,리빙룸(living room), 청주시 서원구 내수동로108번길 51  지하1층 (사창동),
84,일반음식점,해뜨는아구찜, 청주시 서원구 두꺼비로38번길 26  1층 (산남동),
85,일반음식점,이모네 옛날 통닭 닭발, 청주시 서원구 두꺼비로34번길 17  1층 (산남동),
86,일반음식점,미, 청주시 서원구 두꺼비로78번길 21 (산남동  (2층)),
87,일반음식점,사계절고깃집, 청주시 서원구 청남로2005번길 54 (분평동  (1층)),
88,일반음식점,탭플레이 청주사창사거리점, 청주시 서원구 사직대로144번길 12  외 1필지   B동 1층 (사창동),
89,일반음식점,주민상회, 청주시 서원구 1순환로1107번길 10 (분평동  1층),
90,일반음식점,달빛맥주 청주산남점, 청주시 서원구 산남로 22  산남렉슬Ⅱ 1층 109호 (산남동),
91,일반음식점,공계란집.포동포동포차, 청주시 서원구 사운로 92-1  1층 (사직동),
92,일반음식점,한촌설렁탕, 청주시 서원구 1순환로 989  1층 (분평동),
93,일반음식점,갑포, 청주시 서원구 산남로70번길 18 (산남동  102호(1층)),
94,일반음식점,엄마가 뿔났닭, 청주시 서원구 대원로19번길 26  1층 (사직동),
95,일반음식점,피자알볼로(가경점), 청주시 서원구 서부로 1358 (성화동  1층),
96,일반음식점,치코파닭청주1호점, 청주시 서원구 수곡로67번길 23-2  1층 (수곡동),
97,일반음식점,미락, 청주시 서원구 장전로20번길 12 (성화동  단독주택 주건축물제1동(1층)),
98,일반음식점,올레호프, 청주시 서원구 사운로 83 (사직동  나(1층)),
99,일반음식점,옛날통닭, 청주시 서원구 구룡산로 257 (수곡동  (1층)),
100,일반음식점,동그라미, 청주시 서원구 남들로35번길 43 (모충동  (1층)),
101,일반음식점,전이대박, 청주시 서원구 원마루로8번길 8-4 (분평동  (1층)),
102,일반음식점,두릅소한우, 청주시 서원구 산미로 146  빅윈빌딩 1층 103~105호 (산남동),
103,일반음식점,명장복집, 청주시 서원구 산남로70번길 26  청주브릭스타워 2층 201 202호 (산남동),
104,일반음식점,마루벌돌구이(분평점), 청주시 서원구 1순환로 1019-1  가동 1층 (분평동),
105,일반음식점,24시 기사식당, 청주시 서원구 봉명로150번길 41  1층 (사창동  드림빌),
106,일반음식점,수민이네족발, 청주시 서원구 성화로 118  1층 (성화동),
107,일반음식점,인, 청주시 서원구 산남로62번길 15 (산남동  외 1필지 두꺼비빌딩 202호 (2층)),
108,일반음식점,맥주창고, 청주시 서원구 산남로70번길 17  2층 (산남동),
109,일반음식점,산골이야기, 청주시 서원구 1순환로1063번길 111-22  1층 (분평동),
110,일반음식점,한수위 에스(S)★459, 청주시 서원구 서부로 1436 (성화동  (1 2 3층)),
111,일반음식점,해로 산남점, 청주시 서원구 산남로70번길 34  신성미소시티블루1 1층 104호 (산남동),
112,일반음식점,라끌렛, 청주시 서원구 산남로70번길 34  1층 102호 (산남동  외 1필지 신성미소시티블루1 ),
113,일반음식점,청천순대, 청주시 서원구 장전로20번길 20  1층 (성화동),
114,일반음식점,불꽃한우, 청주시 서원구 산남로24번길 18-4  1층 (산남동),
115,일반음식점,봉구비어(수곡점), 청주시 서원구 수곡로37번길 2  1층 (수곡동),
116,일반음식점,치킨앤칩스, 청주시 서원구 모충로25번길 9  1층 104 105호 (개신동),
117,일반음식점,일품생돈, 청주시 서원구 두꺼비로38번길 39  1층 (산남동),
118,일반음식점,닭발삼촌백반, 청주시 서원구 서원남로58번길 4  2층 (모충동),
119,일반음식점,치얼스(cheers), 청주시 서원구 창직로 21  1층 (사창동),
120,일반음식점,에피소드 산남본점, 청주시 서원구 산남로62번길 24  2층 (산남동),
121,일반음식점,분평말자, 청주시 서원구 1순환로1107번길 21  1층 108호 (분평동  조은주차빌딩),
122,일반음식점,좋은밥상, 청주시 서원구 사북로 68-2  1층 (사직동),
123,일반음식점,오호리준, 청주시 서원구 두꺼비로94번길 56-13  1층 (산남동),
124,일반음식점,원조설악추어탕.삼계탕, 청주시 서원구 신성화로 49  1층 (성화동),
125,일반음식점,범프리카 인생치킨, 청주시 서원구 산남로62번길 35  신성미소시티블루2동 1층 111호 (산남동),
126,일반음식점,꼬마비아저씨, 청주시 서원구 서원남로 30 (모충동),
127,일반음식점,대소해장국 산남점, 청주시 서원구 두꺼비로78번길 77  1층 (산남동),
128,일반음식점,풍류(청주점), 청주시 서원구 두꺼비로78번길 65  1층 (산남동),
129,일반음식점,돈까스클럽, 청주시 서원구 청남로1936번길 125  1층 (분평동),
130,일반음식점,나카마, 청주시 서원구 산남로62번길 35  1층 105호 (산남동  신성미소시티블루2),
131,일반음식점,플루메리아, 청주시 서원구 1순환로674번길 18  3층 301호 (사창동),
132,일반음식점,곱창제작소, 청주시 서원구 산남로62번길 24  1층 (산남동),
133,일반음식점,카레자유, 청주시 서원구 사직대로 211  1층 (사직동),
134,일반음식점,명가, 청주시 서원구 산남로 48  2층 203호 (산남동  대운프라자),
135,일반음식점,칭따오양꼬치, 청주시 서원구 두꺼비로20번길 43  101호 (산남동),
136,일반음식점,이자카야청상, 청주시 서원구 내수동로108번길 21  2층 (사창동),
137,일반음식점,히어로즈, 청주시 서원구 서원남로 27-1  2층 (모충동),
138,일반음식점,코나(kona), 청주시 서원구 창신로25번길 3  1층 (사창동),
139,일반음식점,진원소우 청주산남점, 청주시 서원구 산미로 136  2층 (산남동),
140,일반음식점,닭발방, 청주시 서원구 내수동로114번길 28 (사창동),
141,일반음식점,처갓집 양념치킨 분평점, 청주시 서원구 안뜸로 60  1층 (분평동),
142,일반음식점,느낌, 청주시 서원구 서원남로 37  2층 (모충동),
143,일반음식점,도쿄 뒷골목 이야기, 청주시 서원구 두꺼비로94번길 18-5  1층 (산남동),
144,일반음식점,놀부옛날통닭 산남점, 청주시 서원구 산남로 60  1층 111호 (산남동  RS타워),
145,일반음식점,곱창다오, 청주시 서원구 안뜸로 2  2층 (분평동),
146,일반음식점,돼지새끼, 청주시 서원구 1순환로1063번길 61-54  1층 102호 (분평동),
147,일반음식점,동그라미치킨호프, 청주시 서원구 호국로 63  1층 (사직동),
148,일반음식점,엄마식당, 청주시 서원구 청남로2109번길 40-2  1층 (모충동),
149,일반음식점,흑염소사냥, 청주시 서원구 가장로332번길 32-17  1층 (장암동),
150,일반음식점,내풀로, 청주시 서원구 두꺼비로78번길 5  주2동 1층 109호 (산남동),
151,일반음식점,초밥한조각, 청주시 서원구 두꺼비로78번길 5  주2동 1층 107호 (산남동),
152,일반음식점,이찌바텐동, 청주시 서원구 산남로62번길 35  1층 107호 (산남동),
153,일반음식점,청춘짬뽕, 청주시 서원구 장전로6번가길 10  1층 (성화동),
154,일반음식점,퐁당퐁당, 청주시 서원구 쌍샘로 52  1층 (모충동),
155,일반음식점,곱창고, 청주시 서원구 두꺼비로78번길 71  1층 (산남동),
156,일반음식점,숯불닭발, 청주시 서원구 내수동로108번길 26  2층 (사창동),
157,일반음식점,스컬문, 청주시 서원구 두꺼비로78번길 5  주2동 1층 110호 (산남동),
158,일반음식점,친구네포차, 청주시 서원구 청남로2110번길 6  1층 (수곡동),
159,일반음식점,카페 맘스(Cafe moms), 청주시 서원구 수곡로 34  상가2동 1층 108호 (수곡동  두진백로아파트),
160,일반음식점,자연을 담은 돈까스(서원대점), 청주시 서원구 서원남로 53  2층 (모충동),
161,일반음식점,순남시래기, 청주시 서원구 사직대로 160  1층 113호 (사창동  사창 하트리움 에덴),
162,일반음식점,오빠네, 청주시 서원구 서원남로20번길 1  1층 (모충동),
163,일반음식점,젤코바, 청주시 서원구 1순환로1063번길 26  1층 101 102호 (분평동),
164,일반음식점,아속, 청주시 서원구 무심서로 387  1층 (모충동),
165,일반음식점,소학교, 청주시 서원구 산남로 56  1층 108호 (산남동  산남에버프라자),
166,일반음식점,맘스터치 성화점, 청주시 서원구 신화로 34  1층 (성화동),
167,일반음식점,두툼이생고기성화점, 청주시 서원구 장전로12번길 34  1층 101 102 103호 (성화동),
168,일반음식점,와 락, 청주시 서원구 장전로20번다길 14  1층 (성화동),
169,일반음식점,커피박스, 청주시 서원구 1순환로 1059  1층 113호 (분평동),
170,일반음식점,팔팔생고기, 청주시 서원구 구룡산로51번가길 6  1층 101호 (성화동),
171,일반음식점,느낌, 청주시 서원구 1순환로680번길 13-2  2층 (사창동),
172,일반음식점,고추장불고기, 청주시 서원구 수영로 54  1층 (수곡동),
173,일반음식점,치요남치킨수곡점, 청주시 서원구 수곡로37번길 30  1층 (수곡동),
174,일반음식점,오삼구 포차, 청주시 서원구 1순환로672번길 30  5층 (사창동),
175,일반음식점,강릉교동짬뽕 수곡산남점, 청주시 서원구 수곡로37번길 16-15  1층 (수곡동),
176,일반음식점,길밥집, 청주시 서원구 충렬로48번길 3  1층 (사직동),
177,일반음식점,김우동, 청주시 서원구 1순환로751번길 29  상가동 1층 103호 (개신동  태암베스트윙 ),
178,일반음식점,마이플레이스, 청주시 서원구 수곡로99번길 23-1  1층 (수곡동),
179,일반음식점,하루, 청주시 서원구 예체로67번길 32  1층 (사창동),
180,일반음식점,오주 분평점, 청주시 서원구 1순환로 1109  1층 110호 (분평동  호인리더스빌딩),
181,일반음식점,달랑주점, 청주시 서원구 1순환로694번길 4  2층 (사창동),
182,일반음식점,가자 참숯산꼼장어, 청주시 서원구 장전로20번나길 8  1층 (성화동),
183,일반음식점,로스팅 빈, 청주시 서원구 사직대로144번길 35-2  1 2층 (사창동),
184,일반음식점,엘리스, 청주시 서원구 장전로32번길 12  1층 (성화동),
185,일반음식점,놀부분평점(삼겹본능&흥부찜닭), 청주시 서원구 원마루로8번길 8-1  1층 (분평동),
186,일반음식점,쥬시후레쉬, 청주시 서원구 서원남로 57  1층 (모충동),
187,일반음식점,25시 가마솥통닭, 청주시 서원구 무심서로 455  1층 (사직동),
188,일반음식점,아룸파닭, 청주시 서원구 매봉로76번길 44  1층 (수곡동),
189,일반음식점,자갈치 생선구이 전문점, 청주시 서원구 예체로 147-2  1층 (사창동),
190,일반음식점,치킨의민족 청주분평방서점, 청주시 서원구 분평로6번길 8  1층 (분평동),
191,일반음식점,양푼이닭뽀끔탕포차, 청주시 서원구 구룡산로326번길 44  1층 (수곡동),
192,일반음식점,느낌이 좋아, 청주시 서원구 창신로 43  2층 (사창동),
193,일반음식점,으뜸생고기, 청주시 서원구 두꺼비로60번길 11-2  1층 (산남동),
194,일반음식점,홍스팅, 청주시 서원구 봉명로228번길 11-1  1층 (사창동),
195,일반음식점,다드림푸드, 청주시 서원구 남이면 척산길 10  1층,
196,일반음식점,커먼커피(Common Coffee), 청주시 서원구 수곡로 102  한마음2차 상가11동 1층 106호 (수곡동),
197,일반음식점,리원 산남점, 청주시 서원구 산남로70번길 34  1층 113-1호 (산남동  신성미소시티블루1),
198,일반음식점,코코로메시야, 청주시 서원구 산남로70번길 34  1층 114호 (산남동  신성미소시티블루1),
199,일반음식점,더큰도시락 서원대점, 청주시 서원구 무심서로 377-3  2층 (모충동  제1동),
200,일반음식점,나눔의 쉼터, 청주시 서원구 현도면 죽전1길 71  1층,
201,일반음식점,컵오커피(cup o' coffee), 청주시 서원구 사직대로175번길 36  지하층 (사창동),
202,일반음식점,맥심, 청주시 서원구 산남로 56  7층 702호 (산남동  산남에버프라자),
203,일반음식점,사직동 맥주집, 청주시 서원구 예체로 55  상가동 2층 203호 (사직동  푸르지오캐슬),
204,일반음식점,쿄우노식당 개신점, 청주시 서원구 복대로 7  1층 106호 (개신동  대상마스터빌딩),
205,일반음식점,투썸플레이스 청주산남중앙점, 청주시 서원구 산미로 95  2동 1층 (산남동),
206,일반음식점,블링크(BLINK), 청주시 서원구 무심서로 479  1층 (사직동),
207,일반음식점,온니원, 청주시 서원구 복대로 7  대상마스터빌딩 1층 111 112호 (개신동),
208,일반음식점,네오피자 청주1호점, 청주시 서원구 봉명로142번길 45  1층 (사창동),
209,일반음식점,이팔청춘(충북대점), 청주시 서원구 1순환로672번길 19  3층 (사창동),
210,일반음식점,붐붐, 청주시 서원구 1순환로672번길 50  3층 (사창동),
211,일반음식점,하루세끼, 청주시 서원구 내수동로 170-1  1층 (사창동),
212,일반음식점,하누, 청주시 서원구 남이면 청남로 1827-30  1층,
213,일반음식점,두릅돈생갈비, 청주시 서원구 산미로 93  1층 (산남동),
214,일반음식점,쿄우다이, 청주시 서원구 내수동로108번길 18  2층 (사창동),
215,일반음식점,고급라면, 청주시 서원구 1순환로704번길 46  1층 (사창동),
216,일반음식점,국민야시장, 청주시 서원구 1순환로672번길 23  2층 3층 (사창동),
217,일반음식점,제주흑다돈 청주남이면지점, 청주시 서원구 남이면 석실1길 5  1층,
218,일반음식점,피스풀, 청주시 서원구 서원남로 11  1층 (모충동),
219,일반음식점,CnB(씨앤비), 청주시 서원구 장전로20번가길 10  1층 (성화동),
220,일반음식점,드랍더비트, 청주시 서원구 내수동로 107  지하1층 (사창동),
221,일반음식점,더리치, 청주시 서원구 대림로 427  1층 (죽림동),
222,일반음식점,홍어막주소, 청주시 서원구 산남로62번길 35  1층 106호 (산남동  신성미소시티블루2),
223,일반음식점,타임(TIME), 청주시 서원구 산남로 76  1층 106호 (산남동  인템프라자),
224,일반음식점,마더맘치킨 사창점, 청주시 서원구 창직로25번길 30 (사창동  지하 1층),
225,일반음식점,카페앙꼬, 청주시 서원구 내수동로 158-1  1층 (사창동),
226,일반음식점,치킨의민족 청주가경점, 청주시 서원구 성화로 113  1층 (죽림동),
227,일반음식점,달뜨면 술이랑 놀자, 청주시 서원구 호국로3번길 3-18  1층 (모충동),
228,일반음식점,로마(ROMA), 청주시 서원구 산남로 60  2층 203호 (산남동  RS타워),
229,일반음식점,주민상회, 청주시 서원구 구룡산로51번가길 24  1층 101호 (성화동),
230,일반음식점,설풍, 청주시 서원구 매봉로 190  401동 지하1층 103호 (모충동  동일센타시아),
231,일반음식점,디(D), 청주시 서원구 장전로6번가길 17  1층 (성화동),
232,일반음식점,서원 손만두, 청주시 서원구 수곡로58번길 22  1층 (수곡동),
233,일반음식점,먹거리포차, 청주시 서원구 구룡산로 398  1층 (수곡동),
234,일반음식점,찐구네 호들갑오징어, 청주시 서원구 장전로20번나길 10  1층 (성화동),
235,일반음식점,개똥이네포차, 청주시 서원구 1순환로672번길 7  3층 (사창동),
236,일반음식점,밀방, 청주시 서원구 내수동로 140  1층 (사창동),
237,일반음식점,애월(AEWOL), 청주시 서원구 구룡산로52번가길 32  1층 (성화동),
238,일반음식점,쌀좀씹은김밥, 청주시 서원구 구룡산로389번길 33  1층 (수곡동),
239,일반음식점,라일강호프, 청주시 서원구 호국로 55-2  1층 (사직동),
240,일반음식점,비긴어게인, 청주시 서원구 경신로 32-15  1층 (개신동),
241,일반음식점,신(辛)돼갈집, 청주시 서원구 1순환로1063번길 61-14  1층 (분평동),
242,일반음식점,진가네소곱창연구소, 청주시 서원구 복대로17번길 11  1층 103호 (개신동),
243,일반음식점,나카스야시장, 청주시 서원구 원마루로20번길 21  1층 (분평동),
244,일반음식점,대소해장국, 청주시 서원구 남이면 청남로 1827-12  1층,
245,일반음식점,모에루, 청주시 서원구 내수동로 125  1층 (사창동),
246,일반음식점,우리집 숯불고기, 청주시 서원구 내수동로108번길 28  3층 (사창동),
247,일반음식점,고구려짬뽕 분평점, 청주시 서원구 1순환로 1142  주2동 1층 (분평동),
248,일반음식점,워너비 박스(청주산남점), 청주시 서원구 산남로70번길 34  신성미소시티블루1 1층 107호 (산남동),
249,일반음식점,힐데스펍, 청주시 서원구 남이면 청남로 1827-32  1층,
250,일반음식점,하부, 청주시 서원구 두꺼비로20번길 41  재경빌 1층 (산남동),
