연번,업종명,업소명,소     재     지,전화번호
1186,일반음식점,홍이네 무한삼겹살, 청주시 서원구 서원남로 55  2층 (모충동), 043- 298-0220
1187,일반음식점,소문난춘천닭갈비, 청주시 서원구 탑골로 25-1 (산남동 (1층)), 043- 298-0999
1188,일반음식점,용우동, 청주시 서원구 1순환로1063번길 97 (분평동 벤처타워 102호), 043- 298-1122
1189,일반음식점,탁봉순 새우양계장, 청주시 서원구 산남로62번길 31  1층 110~111호 (산남동), 043- 298-2955
1190,일반음식점,본죽(산남법원점), 청주시 서원구 산남로 64  1층 108호 (산남동), 043- 298-3223
1191,일반음식점,막창선생, 청주시 서원구 분평로6번길 40  1층 (분평동), 043- 298-3536
1192,일반음식점,만석이, 청주시 서원구 원흥로64번길 41 (산남동 (1층)), 043- 298-6995
1193,일반음식점,베이스캠프, 청주시 서원구 청남로2005번길 15 (분평동 (1층)), 043- 298-7400
1194,일반음식점,김밥153 잔치국수, 청주시 서원구 매봉로19번길 6  1층 (분평동), 043- 298-8289
1195,일반음식점,땡큐맘치킨 청주산남점, 청주시 서원구 두꺼비로28번길 6  1층 (산남동), 043- 298-8892
1196,일반음식점,샐드위치, 청주시 서원구 사직대로 300  1층 (사직동), 043- 715-7712
1197,일반음식점,트리제이 더 테라스, 청주시 서원구 원흥로 17  2층 201호  202호  203호 (산남동  리더스타운), 043- 716-0242
1198,일반음식점,양지마루, 청주시 서원구 호국로37번길 53-1 (사직동 (1층)), 043- 900-0333
1199,일반음식점,신 추풍령감자탕, 청주시 서원구 사직대로81번길 26  1층 (사창동), 043- 900-9396
1200,일반음식점,보통의 국수집, 청주시 서원구 성봉로242번길 43  1층 (개신동), 043- 902-2760
1201,일반음식점,봉자언니(분평점), 청주시 서원구 원마루로20번길 1  1층 (분평동), 043- 903-7007
1202,일반음식점,태광빈대떡, 청주시 서원구 산남로62번길 15  1층 115호 (산남동), 043- 903-8461
1203,일반음식점,브라보퍼블릭골프개신점 그늘집, 청주시 서원구 성봉로 178  3층 (개신동), 043- 904-0707
1204,일반음식점,총각네 손 고추만두, 청주시 서원구 내수동로 140  1층 (사창동), 043- 905-6799
1205,일반음식점,서원전집, 청주시 서원구 용호로15번길 21  1층 (성화동), 043- 908-4358
1206,일반음식점,뽀까치기, 청주시 서원구 신율로 49 (개신동 (114  115호)), 043-232 -4457
1207,일반음식점,정육식당, 청주시 서원구 신화로36번길 42  1층 104호  105호 (성화동  드림프라자1), 043-232 -9879
1208,일반음식점,감탄성화점, 청주시 서원구 신화로 33 (성화동 (110)호), 043-233 -5888
1209,일반음식점,까투리, 청주시 서원구 모충로96번길 16 (모충동), 043-2347- 625
1210,일반음식점,레몬(LEMON), 청주시 서원구 장전로 18  1층 (성화동), 043-235 -8579
1211,일반음식점,베스트, 청주시 서원구 신화로 38 (성화동 (501호)), 043-238 -7878
1212,일반음식점,신촌장어구이, 청주시 서원구 대원로 35  1층 (사직동), 043-2503-362
1213,일반음식점,인도네팔레스토랑(First Nepal Restaurant), 청주시 서원구 내수동로114번길 7 (사창동 (2층)), 043-260 -5363
1214,일반음식점,빨봉분식충북대점, 청주시 서원구 1순환로672번길 51  2층 (사창동), 043-263 -7897
1215,일반음식점,모리스시, 청주시 서원구 1순환로 641-1 (사창동 (1층)), 043-264 -3579
1216,일반음식점,마루(회덮밥전문점), 청주시 서원구 1순환로672번길 62 (사창동 (1층)), 043-264 -5855
1217,일반음식점,도누가그릴2, 청주시 서원구 내수동로108번길 15 (사창동  (지하1층)), 043-265 -9300
1218,일반음식점,토리덴2, 청주시 서원구 1순환로672번길 30 (사창동 (1층)), 043-265 -9900
1219,일반음식점,돈스치킨, 청주시 서원구 성봉로169번길 41-4 (개신동 (1층)), 043-266 -9922
1220,일반음식점,비비큐(BBQ)사직.사창점, 청주시 서원구 창직로29번길 30 (사창동 (1층)), 043-269 -2244
1221,일반음식점,뉴욕야시장, 청주시 서원구 1순환로674번길 38 (사창동 (1층)), 043-271 -6692
1222,일반음식점,더덕 솥뚜껑 삼겹살(모충점), 청주시 서원구 쌍샘로 94 (모충동  (1층)), 043-273 -4470
1223,일반음식점,병정문어볼, 청주시 서원구 1순환로674번길 72 (사창동), 043-273 -5797
1224,일반음식점,굽네치킨사창 사직2점, 청주시 서원구 사직대로144번길 35-2  1층 (사창동), 043-273 -9289
1225,일반음식점,좋은맛집, 청주시 서원구 예체로7번길 44  삼익아파트A동상가  108 109 110 111호 (개신동), 043-274 -2279
1226,일반음식점,어미락 생선구이, 청주시 서원구 1순환로 1130-5  1동 1층 (분평동), 043-283 -9289
1227,일반음식점,우리식당, 청주시 서원구 남들로 5-1 (수곡동), 043-284 -2506
1228,일반음식점,김가네탕, 청주시 서원구 구룡산로 331-5  1층 (수곡동), 043-284 -6801
1229,일반음식점,보쌈한판17 000, 청주시 서원구 수곡로 87  1층 (수곡동), 043-285 -3078
1230,일반음식점,둘이서함께, 청주시 서원구 수곡로3번길 64 (수곡동), 043-285 -8555
1231,일반음식점,큰통치킨, 청주시 서원구 수곡로 41-1  1층 (수곡동), 043-285 -9595
1232,일반음식점,카카오 떡 수곡산남점, 청주시 서원구 수곡로77번길 8-6  1층 (수곡동), 043-286 -8766
1233,일반음식점,노군꼬치, 청주시 서원구 산남로62번길 25  111호 (산남동 남양빌딩), 043-287 -0079
1234,일반음식점,돈벌면뭐한우식당, 청주시 서원구 수곡로27번길 26 (수곡동 (1층)), 043-287 -0117
1235,일반음식점,시골애, 청주시 서원구 산남로70번길 17 (산남동 (1층)), 043-288 -0021
1236,일반음식점,힐링포차고등어, 청주시 서원구 구룡산로 332 (수곡동  외 2필지(1층)), 043-288 -7278
1237,일반음식점,미가네, 청주시 서원구 남들로35번길 4 (모충동 (1층)), 043-288 -8741
1238,일반음식점,하루, 청주시 서원구 산남로24번길 3 (산남동 외1필지(110호)), 043-291 -3009
1239,일반음식점,청해가, 청주시 서원구 두꺼비로94번길 12-17 (산남동  (1층)), 043-292 -3306
1240,일반음식점,네네치킨산남3지구성화점, 청주시 서원구 원흥로 14  2동 1층 104호 (산남동  부영상가), 043-292 -4479
1241,일반음식점,Vegas(베가스), 청주시 서원구 산남로62번길 30 (산남동 (2층)), 043-292 -5070
1242,일반음식점,두꺼비막걸리촌, 청주시 서원구 청남로2109번길 39-2 (수곡동 (1층)), 043-295 -5362
1243,일반음식점,육선생, 청주시 서원구 산남로 56  1층 107호 (산남동), 043-295 -5882
1244,일반음식점,맛있는숯불구이, 청주시 서원구 예체로67번길 30 (사창동 (1층)), 043-908 -8853
1245,일반음식점,비원, 청주시 서원구 내수동로 115 (사창동 (지하1층)), 070-4047-3515
1246,일반음식점,컴힐(COMHILL), 청주시 서원구 내수동로102번길 52  지하1층~1층 (사창동), 070-5067-0302
1247,일반음식점,빨간곱창, 청주시 서원구 서원남로57번길 7 (모충동 (1층)), 070-8107-2830
1248,일반음식점,베로분식에스프레소, 청주시 서원구 1순환로674번길 66 (사창동 (1층)), 070-8803-0590
1249,일반음식점,돈두루, 청주시 서원구 1순환로1063번길 61-6 (분평동 (2층)), 070-8822-3671
1250,일반음식점,엉클스, 청주시 서원구 성봉로169번길 47-1 (개신동  (1층)), 070-8824-3039
1251,일반음식점,청천순대, 청주시 서원구 창직로 18 (사창동 외1필지(1층)), 070-8842-1848
1252,일반음식점,꽁보리밥, 청주시 서원구 산남로70번길 34 (산남동 신성미소시티블루1 (1층) 115호), 070-8883-9612
1253,일반음식점,뚱이족발, 청주시 서원구 구룡산로371번길 88-2 (모충동 (1층)), 043-275 5340
1254,일반음식점,담소, 청주시 서원구 청남로2109번길 6 (모충동 (1층)),
1255,일반음식점,비에이치씨(BHC)치킨, 청주시 서원구 1순환로1063번길 24 (분평동 103호),
1256,일반음식점,무한사케무사청주산남점, 청주시 서원구 산남로 38 (산남동 외1필지 (제1층  제111호 제112호)),
1257,일반음식점,김밥여행, 청주시 서원구 사운로 83  1층 (사직동  나),043-256-9793
1258,일반음식점,보리밥집, 청주시 서원구 사직대로265번길 7 (사직동 (1층)),043-266-5298
1259,일반음식점,두메나산골, 청주시 서원구 내수동로 151 (사창동),043-266-7897
1260,일반음식점,막창선생, 청주시 서원구 예체로19번길 7 (개신동 (1층)),043-267-3233
1261,일반음식점,원호연의뚝썩삼겹살, 청주시 서원구 1순환로704번길 42 (사창동 (1층)),043-272-9279
1262,일반음식점,종가대박집, 청주시 서원구 1순환로674번길 16 (사창동 (2층)),043-277-6284
1263,일반음식점,오디세이, 청주시 서원구 산남로 64  2층 201호 202호 (산남동  엔젤변호사빌딩),043-284-0033
1264,일반음식점,서원골, 청주시 서원구 서원남로 41-1 (모충동 (1층)),043-288-9002
1265,일반음식점,임실피자치킨, 청주시 서원구 산남로 76 (산남동 인템프라자 104호(1층)),043-292-9272
1266,일반음식점,도야족발, 청주시 서원구 1순환로1107번길 21 (분평동 (1층) 118호),043-296-3088
1267,일반음식점,실내포장마차, 청주시 서원구 청남로2109번길 7 (수곡동 (1층)),
1268,일반음식점,본죽 청주사창점, 청주시 서원구 사직대로 125-1  1층 (사창동),
1269,일반음식점,대전식당, 청주시 서원구 청남로2109번길 15  1층 (수곡동),
1270,일반음식점,개신상회, 청주시 서원구 복대로17번길 7-31 (개신동 (2층)),
1271,일반음식점,포차플레잉, 청주시 서원구 1순환로 678  1층 (사창동),
1272,일반음식점,차의향기, 청주시 서원구 남이면 석판1길 35-28  1층,
1273,일반음식점,프랜즈(친구들), 청주시 서원구 장전로20번길 8  1층 (성화동),
1274,일반음식점,명제만두집, 청주시 서원구 내수동로 130 (사창동  (평화아파트 상가 1층 6호(106호))),
1275,일반음식점,푸드스토리 온기, 청주시 서원구 수곡로 98  상가10동 2층 201호 (수곡동),
1276,일반음식점,청주해물포차, 청주시 서원구 청남로 2097  1층 (수곡동),
1277,일반음식점,비생전, 청주시 서원구 구룡산로51번나길 11  1층 (성화동),
1278,일반음식점,스트릿츄러스 충북대점, 청주시 서원구 1순환로674번길 3  1층 (사창동),
1279,일반음식점,양평해장국, 청주시 서원구 두꺼비로94번길 26-6  1층 (산남동),
1280,일반음식점,년재호, 청주시 서원구 1순환로 1047  지하1층 (분평동),
1281,일반음식점,약선족발, 청주시 서원구 사직대로164번길 59 (사창동 (1층)),
1282,일반음식점,복성루, 청주시 서원구 1순환로1063번길 36  1층 (분평동),
1283,일반음식점,강정이기가막혀&웰덤치킨분평산남점, 청주시 서원구 1순환로1013번길 17  1층 (분평동),
1284,일반음식점,육이, 청주시 서원구 안뜸로 60  1층 101호 (분평동),
1285,일반음식점,153찹쌀호떡분식, 청주시 서원구 청남로2122번길 4 (모충동 (1층)),
1286,일반음식점,달달(DALDAL), 청주시 서원구 1순환로1107번길 21  1층 112호 (분평동),
1287,일반음식점,가마리추어탕, 청주시 서원구 남이면 2순환로 1689-9  1층,
1288,일반음식점,Tamang Lasa Phil. Restaurant (타망라스 필리핀 레스토랑), 청주시 서원구 사직대로 279-1  1층 (사직동),
1289,일반음식점,정통춘천닭갈비(성화점), 청주시 서원구 신성화로 38  1층 101호 (성화동),
1290,일반음식점,도쿄이즈미, 청주시 서원구 산남로 76  3층 301호 302호 303호  304호 (산남동  인템프라자),
1291,일반음식점,미유, 청주시 서원구 원흥로 72  1층 (산남동),
1292,일반음식점,설빙충북대점, 청주시 서원구 1순환로674번길 3 (사창동 (2 3층)),
1293,일반음식점,신 후다닭발, 청주시 서원구 산남로70번길 34  1층 116호 (산남동),
1294,일반음식점,부산할매수육국밥.냉면, 청주시 서원구 1순환로 669  1층 (사창동),
1295,일반음식점,두리네밥도둑 수곡분평점, 청주시 서원구 수곡로99번길 7-9  1층 (수곡동),
1296,일반음식점,유메, 청주시 서원구 산남로70번길 26  1층 110-1호 (산남동),
1297,일반음식점,골목식당, 청주시 서원구 서부로1465번길 28-3  1층 (개신동),
1298,일반음식점,삼구 포차, 청주시 서원구 1순환로672번길 30 (사창동 (3 4층)),
1299,일반음식점,이화전집, 청주시 서원구 원마루로8번길 2  1층 (분평동),
1300,일반음식점,다미김밥, 청주시 서원구 장전로 26 (성화동 (1층)),
1301,일반음식점,이모네김밥, 청주시 서원구 모충로 18  1층 (개신동),
1302,일반음식점,코리아닭발, 청주시 서원구 1순환로680번길 5 (사창동 (1층)),
1303,일반음식점,아쿠아횟집, 청주시 서원구 예체로 11  1층 (개신동),
1304,일반음식점,트럭, 청주시 서원구 산남로 68  1층 106호 (산남동  센타프라자),
1305,일반음식점,매전, 청주시 서원구 1순환로672번길 48 (사창동  (지하1층)),
1306,일반음식점,25시 국가대표짬뽕, 청주시 서원구 서원남로20번길 4  1층 (모충동),
1307,일반음식점,공주칼국수, 청주시 서원구 성화로 122  1층 (성화동),
1308,일반음식점,엔젤푸드, 청주시 서원구 장전로20번길 39 (성화동 (1층)),
1309,일반음식점,영양센타, 청주시 서원구 산남로62번길 31  1층 106 109호 (산남동),
1310,일반음식점,달, 청주시 서원구 산남로70번길 34  1층 117호 (산남동  신성미소시티블루1 ),
1311,일반음식점,사시미특공대, 청주시 서원구 개신동 438번지 93호  438-120 ,
1312,일반음식점,느린하루산남점, 청주시 서원구 두꺼비로78번길 25  1층 101호 (산남동),
1313,일반음식점,커피자유, 청주시 서원구 사직대로 211  B동 1층 (사직동),
1314,일반음식점,한마을손두부, 청주시 서원구 수곡로 116  1층 (수곡동),
1315,일반음식점,산남닭발, 청주시 서원구 수곡로 102  11동 103호 (수곡동  한마음2차상가),
1316,일반음식점,심봉사 도로케, 청주시 서원구 창신로 39  1층 (사창동),
1317,일반음식점,설탕수다, 청주시 서원구 성화로 71  1층 (죽림동),
1318,일반음식점,sazio(충만한), 청주시 서원구 모충로25번길 22  1층 (개신동),
1319,일반음식점,구르만, 청주시 서원구 사직대로99번길 7  평화빌라 1층 (사창동),
1320,일반음식점,린호프, 청주시 서원구 호국로 57  1층 (사직동),
1321,일반음식점,거기, 청주시 서원구 구룡산로51번라길 1  1층 (성화동),
1322,일반음식점,맛깔참죽 청주사직점, 청주시 서원구 흥덕로 48  F동 2층 (사직동),
1323,일반음식점,다사랑치킨피자호프(분평점), 청주시 서원구 1순환로1107번길 17  OK빌딩 1층 105호 106호 (분평동),
1324,일반음식점,카페인, 청주시 서원구 내수동로114번길 18  2층 (사창동),
1325,일반음식점,김밥나라개신점, 청주시 서원구 모충로 17  1층 (개신동),
1326,일반음식점,철이네, 청주시 서원구 안뜸로 20-16  1층 (분평동),
1327,일반음식점,우이재, 청주시 서원구 1순환로 1144 (분평동 (1 2층)),
1328,일반음식점,토담순대 산남점, 청주시 서원구 원흥로100번길 27-22  1층 (산남동),
1329,일반음식점,타볼라, 청주시 서원구 무심서로 487  2층 (사직동),
1330,일반음식점,벌집삼겹살, 청주시 서원구 청남로 1994  1층 (분평동),
1331,일반음식점,콩불, 청주시 서원구 구룡산로337번길 112  1층 (모충동),
1332,일반음식점,뚝썩 삼겹살, 청주시 서원구 서원남로 39  1층 (모충동),
1333,일반음식점,경아두마리치킨, 청주시 서원구 구룡산로 275-5  상가동 1층 104호 (수곡동  산남영구임대아파트),
1334,일반음식점,바다면발, 청주시 서원구 사운로85번길 22  1층 (사직동),
1335,일반음식점,열두시(12:00AM), 청주시 서원구 1순환로672번길 34  지하1층 (사창동),
1336,일반음식점,우즈벡임, 청주시 서원구 1순환로672번길 52 (사창동 (2층)),
1337,일반음식점,24시 전주명가 콩나물국밥, 청주시 서원구 산남로 48  1층 104 105호 (산남동  대운프라자),
1338,일반음식점,예향정 산남점, 청주시 서원구 산남로 50  1층 101호 (산남동),
1339,일반음식점,빛나리, 청주시 서원구 서원남로 48  1층 (모충동),
1340,일반음식점,오주 개신점, 청주시 서원구 모충로 33-1 (개신동),
1341,일반음식점,차이나옌지, 청주시 서원구 성화로 110  1층 (성화동),
1342,일반음식점,타스코(Taxco), 청주시 서원구 산남로62번길 35  1층 109호 (산남동),
1343,일반음식점,광릉불고기, 청주시 서원구 1순환로 763  1층 (개신동),
1344,일반음식점,마중호프, 청주시 서원구 수곡로 56  2층 (수곡동),
1345,일반음식점,순희보리밥집, 청주시 서원구 창신로26번길 3  1층 (사창동),
1346,일반음식점,파티지니, 청주시 서원구 대림로421번가길 53-4  1층 (죽림동),
1347,일반음식점,고봉민김밥인 성화점, 청주시 서원구 신화로36번길 7  1층 103호 (성화동),
1348,일반음식점,투다리원마루점, 청주시 서원구 원마루로20번길 3 (분평동),
1349,일반음식점,황금돼지, 청주시 서원구 매봉로12번길 47  1층 (분평동),
1350,일반음식점,삼주식당, 청주시 서원구 사직대로 279-8  2층 (사직동  가),
1351,일반음식점,예당, 청주시 서원구 두꺼비로34번길 20  1층 (산남동),
1352,일반음식점,착한전복산남점, 청주시 서원구 산남로70번길 14 (산남동 (2층)),
1353,일반음식점,묵사발 산남점, 청주시 서원구 두꺼비로30번길 24  1층 (산남동),
1354,일반음식점,척산칼국수, 청주시 서원구 남이면 청남로 1215,
1355,일반음식점,보리수, 청주시 서원구 호국로 77-1 (사직동),
1356,일반음식점,신라, 청주시 서원구 산남로70번길 3  2층 202호 (산남동  산남메디프라자),
1357,일반음식점,모충식당, 청주시 서원구 청남로2155번길 13-1  1층 (모충동  (A동)),
1358,일반음식점,밥장군, 청주시 서원구 남이면 청남로 1164  1층,042 -826 -4033
1359,일반음식점,송림가든, 청주시 서원구 현도면 노산하석로 81,042 -931 -0931
1360,일반음식점,낙원식당, 청주시 서원구 현도면 대청호반로 9  1층,042 -931 -2888
1361,일반음식점,해뜨는집, 청주시 서원구 현도면 노산2길 3-41 ( 377-4),042 -931 -5233
1362,일반음식점,돈탑, 청주시 서원구 현도면 대청호반로 13  1층,042 -931 -7666
1363,일반음식점,작품하나, 청주시 서원구 현도면 노산하석로 27  1층,042 -931 -9200
1364,일반음식점,천년가, 청주시 서원구 현도면 청남로 86-6,042 -931 -9944
1365,일반음식점,대청가, 청주시 서원구 현도면 청남로 13  1층,042 -932 -0355
1366,일반음식점,금수장장어구이, 청주시 서원구 현도면 청남로 16  1층,042 -932 -0940
1367,일반음식점,돌고래횟집, 청주시 서원구 현도면 노산2길 3-74,042 -932 -1806
1368,일반음식점,오가리식당, 청주시 서원구 현도면 대청호반로 4,042 -932 -2885
1369,일반음식점,슬로울리, 청주시 서원구 현도면 대청호반로 5  1층,042 -932 -2889
1370,일반음식점,숯골진냉면, 청주시 서원구 현도면 노산하석로 89,042 -932 -4349
1371,일반음식점,향기원, 청주시 서원구 현도면 노산하석로 17-8  1층,042 -932 -4939
1372,일반음식점,금호송어장, 청주시 서원구 현도면 노산하석로 166  1층,042 -932 -5050
1373,일반음식점,노산장식당, 청주시 서원구 현도면 달계노산로 326-28,042 -932 -6766
1374,일반음식점,살롱드스테이, 청주시 서원구 현도면 노산하석로 17-14,042 -932 -9898
1375,일반음식점,솔향기, 청주시 서원구 현도면 노산2길 3-70,042 -934 -6275
1376,일반음식점,북경탕수육, 청주시 서원구 내수동로 130  상가동 103호 (사창동 평화아파트),
1377,일반음식점,막곱닭1, 청주시 서원구 쌍샘로 94 (모충동  (1층)),
1378,일반음식점,압구정봉구비어개신점, 청주시 서원구 모충로 33-1 (개신동  외1필지(1층)),
1379,일반음식점,박카스, 청주시 서원구 원흥로 17  리더스타운 1층 112호 (산남동),043 - 221-6344
1380,일반음식점,콤마, 청주시 서원구 1순환로 664  2층 (사창동),043 - 260-6250
1381,일반음식점,BHC(비에이치씨), 청주시 서원구 예체로 86 (사창동  (1층)),043 - 266-9977
1382,일반음식점,양평소한마리해장국, 청주시 서원구 현도면 청남로 331  1층,043 - 272-9599
1383,일반음식점,귀족명가 한방왕족발, 청주시 서원구 구룡산로337번길 75  A동 1층 (모충동),043 - 285-0805
1384,일반음식점,부산꼼장어, 청주시 서원구 원흥로64번길 13 (산남동 (1층)),043 - 285-3388
1385,일반음식점,갑진즉석, 청주시 서원구 청남로 2084 (수곡동),043 - 291-5962
1386,일반음식점,요조라, 청주시 서원구 산남로 76  인템프라자 1층 110  111호 (산남동),043 - 293-8959
1387,일반음식점,장어촌, 청주시 서원구 두꺼비로94번길 12-18  1층 (산남동),043 -211 -5202
1388,일반음식점,베스트 7080, 청주시 서원구 사직대로 271  지하1층 (사직동),043 -211 -6663
1389,일반음식점,꼬마김밥, 청주시 서원구 용호로15번길 21  1층 (성화동),043 -211 -9935
1390,일반음식점,착한순대, 청주시 서원구 예체로19번길 8  A동 1층 101 102호 (개신동),043 -212 -5931
1391,일반음식점,진구네감자탕, 청주시 서원구 안뜸로47번길 2  1층 (분평동),043 -212 -7979
1392,일반음식점,아바이병천순대, 청주시 서원구 사직대로 221  1층 (사직동),043 -216 -1612
1393,일반음식점,포항막회, 청주시 서원구 모충로 48-1  가2동 1층 (개신동),043 -216 -6696
1394,일반음식점,천상대게, 청주시 서원구 용호로 38  주1동 지하 1층~지상 1층 (성화동),043 -218 -0808
1395,일반음식점,페리카나피친호프, 청주시 서원구 장구봉로 130 (개신동 (1층)),043 -218 -9292
1396,일반음식점,현고들깨손칼국수, 청주시 서원구 성봉로220번길 16  가동 1층 (개신동),043 -221 -4003
1397,일반음식점,브라보치킨피자청주성안길점, 청주시 서원구 예체로 96-1  1층 (사창동),043 -221 -4715
1398,일반음식점,대왕산삼본가, 청주시 서원구 산남로24번길 18-1  1층 (산남동),043 -221 -8382
1399,일반음식점,신반장의 한양 참숯 뒷고기, 청주시 서원구 1순환로648번길 5-3  1층 (사창동),043 -222 -6066
1400,일반음식점,낚시광, 청주시 서원구 신화로36번길 32  1층 110 111호 (성화동),043 -222 -7755
1401,일반음식점,와우, 청주시 서원구 사운로 47  A동 1층 (사직동),043 -223 -0306
1402,일반음식점,이조가, 청주시 서원구 복대로 15  1층 (개신동),043 -223 -3350
1403,일반음식점,설향감자탕&갈비탕, 청주시 서원구 두꺼비로94번길 12-21  1층 (산남동),043 -223 -7126
1404,일반음식점,훈훈한 식당, 청주시 서원구 청남로2005번길 40  상가동 1층 108호 (분평동  우성2차아파트),043 -224 -5353
1405,일반음식점,윌(will), 청주시 서원구 두꺼비로78번길 63-1  4층 (산남동),043 -230 -5004
1406,일반음식점,봉마담쌀롱, 청주시 서원구 용호로5번길 42  1층 (죽림동),043 -231 -0129
1407,일반음식점,성화생고기, 청주시 서원구 장전로20번길 64  1층 (성화동),043 -231 -0408
1408,일반음식점,청주어시장물회, 청주시 서원구 용호로6번길 17  1층 (죽림동),043 -231 -1278
1409,일반음식점,김밥천국, 청주시 서원구 복대로 27  1층 103호 (개신동),043 -231 -1377
1410,일반음식점,고기고기워낭소리, 청주시 서원구 장전로6번가길 17  1층 (성화동),043 -231 -3335
1411,일반음식점,피자헛 청주가경점, 청주시 서원구 복대로 13  1층 101 일부호 (개신동),043 -231 -3697
1412,일반음식점,멍게수산, 청주시 서원구 산남로24번길 11  1층 (산남동),043 -231 -4032
1413,일반음식점,반도회수산, 청주시 서원구 용호로 6  1층 (죽림동),043 -231 -4677
1414,일반음식점,아노참치&스시, 청주시 서원구 용호로 66  1층 (성화동),043 -231 -5300
1415,일반음식점,홍어양조장, 청주시 서원구 구룡산로51번나길 5  1층 (성화동),043 -231 -5359
1416,일반음식점,반하다, 청주시 서원구 복대로 27  1층 101 102호 (개신동),043 -231 -5594
1417,일반음식점,호반호프, 청주시 서원구 구룡산로 24  D동 1층 105호 (성화동  성화호반베르디움),043 -231 -5823
1418,일반음식점,남해해물, 청주시 서원구 용호로5번길 60  1층 (죽림동),043 -231 -5933
1419,일반음식점,성이네참숯옛날막창, 청주시 서원구 구룡산로51번가길 5  1층 (성화동),043 -231 -7029
1420,일반음식점,램프의이야기, 청주시 서원구 남이면 대림로 316  1층,043 -231 -7085
